id,topic_id,type,text,answer,options,irt_a,irt_b
196,10,MCQ,"Consider a program with the following structure:

```c
printf(\""Process A\"");
if (fork() == 0) {
    printf(\""Process B\"");
    if (fork() == 0) {
        printf(\""Process C\"");
    }
} else if (fork() == 0) {
    printf(\""Process D\"");
}
```

Which of the following correctly describes the relationship and execution order of these processes?","""B""","{""A"": ""Process C must be created before Process D because the code block for Process B and C appears first."", ""B"": ""Process D can be created before Process C because process scheduling is non-deterministic, allowing the parent Process A to execute its second fork before Process B executes its fork."", ""C"": ""Process D cannot be created unless Process C has already terminated and returned its exit status."", ""D"": ""Process B and Process D are sibling processes created by the same `fork()` call.""}",1.1,0.5
197,10,MCQ,"In a multi-threaded application, if a single thread invokes the standard POSIX `fork()` system call, what is the behavior regarding the threads in the newly created child process?","""B""","{""A"": ""The child process duplicates all threads that were running in the parent process."", ""B"": ""The child process contains only a duplicate of the calling thread; other threads from the parent process do not exist in the child."", ""C"": ""The child process terminates immediately because multi-threaded processes cannot safely call `fork()`."", ""D"": ""The child process starts with a single new thread executing from the `main()` function, ignoring the state of the calling thread.""}",1.1,0.5
198,10,MCQ,"Why does a page fault or a blocking system call in a user-level thread implementation cause the entire process (including all other runnable threads) to block, whereas in a kernel-level thread implementation it does not?","""B""","{""A"": ""User-level threads share a single execution stack, meaning a block on one thread's stack physically prevents access to others."", ""B"": ""The operating system kernel is unaware of user-level threads and only schedules the containing process as a single entity; thus, any blocking event blocks the entire process."", ""C"": ""Kernel-level threads run in kernel mode and can bypass page faults by directly accessing physical memory addresses."", ""D"": ""User-level thread libraries intentionally block all threads during any I/O operation to prevent data corruption in the shared heap.""}",1.1,0.5
199,10,MCQ,Which of the following instructions or operations is typically permitted to execute in both User Mode and Kernel Mode?,"""B""","{""A"": ""Disabling all hardware interrupts."", ""B"": ""Reading the time-of-day clock."", ""C"": ""Changing the memory map / page tables."", ""D"": ""Setting the system's time-of-day clock.""}",1.1,0.5
200,10,MCQ,"In a multiprogramming system, if each process spends a fraction \(p\) of its time waiting for I/O, the probability that all \(n\) processes are waiting for I/O simultaneously is \(p^n\). If you design a system where each process spends \(70\%\) of its time waiting for I/O, what is the minimum number of active processes required to keep the CPU busy at least \(95\%\) of the time?","""C""","{""A"": ""7"", ""B"": ""8"", ""C"": ""9"", ""D"": ""10""}",1.2,1
201,10,MCQ,"When comparing User-Level Threads (ULT) and Kernel-Level Threads (KLT), which of the following correctly evaluates the system's behavior when a thread encounters a page fault (such as on its stack or swapped memory)?","""B""","{""A"": ""In both ULT and KLT, the kernel can identify the specific thread that caused the page fault and block only that thread, allowing others to run."", ""B"": ""In ULT, a page fault blocks the entire process (including all of its threads) because the kernel only manages processes; in KLT, the kernel can block only the faulting thread while letting other threads in the process continue."", ""C"": ""In KLT, a page fault blocks the entire process because the kernel-level scheduler must reload the entire process control block; in ULT, the user-level library can bypass the kernel to handle the page fault without blocking."", ""D"": ""In ULT, page faults are handled entirely in user space by the thread table, meaning no threads are ever blocked; in KLT, page faults always result in process termination.""}",1.2,1
202,10,MCQ,"Consider a program where Process A executes the following code:

```c
printf(""Process A"");
if (fork() == 0) {
    printf(""Process B"");
    if (fork() == 0) {
        printf(""Process C"");
    }
} else if (fork() == 0) {
    printf(""Process D"");
}
```

Which of the following correctly describes the process hierarchy and the creation order of these processes?","""A""","{""A"": ""Process A is the parent of B and D, while Process B is the parent of C; due to scheduling non-determinism, Process D can be created before Process C."", ""B"": ""Process A is the parent of B, B is the parent of C, and C is the parent of D; Process D must always be created last."", ""C"": ""Process A is the parent of B, C, and D; all three children are created concurrently directly by Process A."", ""D"": ""Process A is the parent of B, B is the parent of C, and Process B is also the parent of D; Process C must always be created before Process D.""}",1.2,1
203,10,MCQ,Which of the following statements correctly analyzes the security and architectural reasons for restricting certain CPU instructions to Kernel Mode rather than allowing them in User Mode?,"""B""","{""A"": ""Reading the time of day clock must be restricted to Kernel Mode to prevent user processes from altering the system's chronological order, whereas changing the memory map can be safely done in User Mode."", ""B"": ""Disabling all interrupts must be restricted to Kernel Mode because interrupts are critical for kernel operations like scheduling; allowing a user-mode process to disable interrupts could allow it to monopolize the CPU indefinitely."", ""C"": ""Changing the memory map is allowed in User Mode to facilitate rapid virtual-to-physical address translation, while setting the time of day is restricted to Kernel Mode solely to save CPU cycles."", ""D"": ""All instructions are allowed in both modes, but User Mode executes them with a software delay to simulate lower privilege levels.""}",1.2,1
204,10,MCQ,What is the name of the operating system mascot that Linus Torvalds chose after being bitten by a penguin in 1996?,"""B""","{""A"": ""Pintos"", ""B"": ""Tux"", ""C"": ""Minix"", ""D"": ""Hurd""}",1,-1
205,10,MCQ,Which of the following is a key characteristic of a Monolithic Kernel?,"""C""","{""A"": ""It runs entirely in user-mode to prevent crashes."", ""B"": ""It is structured with separate servers for file access and device I/O."", ""C"": ""The entire kernel executes as a single executable within its own address space."", ""D"": ""It is a minimal kernel providing only very basic interprocess communication.""}",1,-1
206,10,MCQ,What is the name of the process control block (PCB) in the Linux kernel?,"""C""","{""A"": ""proc_struct"", ""B"": ""pcb_t"", ""C"": ""task_struct"", ""D"": ""control_block""}",1,-1
207,10,MCQ,Which POSIX function is used to create a new thread?,"""B""","{""A"": ""fork()"", ""B"": ""pthread_create()"", ""C"": ""pthread_yield()"", ""D"": ""execve()""}",1,-1
208,10,MCQ,Which of the following is an advantage of monolithic kernels?,"""C""","{""A"": ""Excellent robustness, as failures in one component do not crash the system"", ""B"": ""Low complexity, making it easy to prove correctness"", ""C"": ""Fast communication between kernel components since they share a single address space"", ""D"": ""Strong isolation between different parts of the kernel""}",1,-0.5
209,10,MCQ,What is the primary purpose of POSIX in operating systems?,"""A""","{""A"": ""To provide a Unix-like interface that allows developers to write programs that can run across multiple operating systems"", ""B"": ""To serve as the lowest-level hardware abstraction layer specifically for Windows NT"", ""C"": ""To manage battery power and CPU sleep cycles on smartphones"", ""D"": ""To act as a virtual machine that compiles Java bytecode into native machine code""}",1,-0.5
210,10,MCQ,Which system call is used in Linux to implement the 'fork' process creation?,"""B""","{""A"": ""execve"", ""B"": ""clone"", ""C"": ""waitpid"", ""D"": ""kill""}",1,-0.5
211,10,MCQ,What does a context switch in an operating system involve?,"""A""","{""A"": ""Switching the CPU from executing one process to another, saving and restoring memory maps, registers, and other process states"", ""B"": ""Converting a monolithic kernel into a microkernel dynamically"", ""C"": ""Moving a process from user mode to kernel mode during a standard function call"", ""D"": ""Recompiling the operating system binary to run on a different processor architecture""}",1,-0.5
212,10,MCQ,Which of the following is a key characteristic of User Level Threads?,"""B""","{""A"": ""The kernel is fully aware of individual threads and schedules them directly."", ""B"": ""A blocking system call on one thread blocks all other threads in that process."", ""C"": ""They require expensive kernel involvement for creation and switching."", ""D"": ""They cannot be customized with application-specific schedulers.""}",1,-0.5
213,10,MCQ,"Under resource management, different types of operating systems prioritize different resources. What resource is specifically highlighted as a critical constraint that must be conserved by a smartphone's operating system?","""C""","{""A"": ""Computational performance of the processors"", ""B"": ""Network bandwidth and congestion control"", ""C"": ""Battery power"", ""D"": ""Virtual memory swap space""}",1,0
214,10,MCQ,"In operating system design, certain instructions are restricted to kernel mode to prevent user processes from corrupting the system. Which of the following instructions is typically allowed in both user mode and kernel mode?","""B""","{""A"": ""Disable all interrupts"", ""B"": ""Read the time of day clock"", ""C"": ""Change the memory map"", ""D"": ""Set the time of day""}",1,0
215,10,MCQ,"If each process running on a system spends \(80\%\) of its time waiting for I/O, what is the minimum number of such processes that must be running concurrently to ensure that the CPU is wasted \(10\%\) or less of the time?","""C""","{""A"": ""8 processes"", ""B"": ""10 processes"", ""C"": ""11 processes"", ""D"": ""12 processes""}",1,0
216,10,MCQ,What is a major disadvantage of implementing threads entirely at the user level (User Level Threads) rather than at the kernel level?,"""B""","{""A"": ""Thread creation, termination, and switching are significantly slower."", ""B"": ""Any blocking system call (such as for I/O) made by a single thread will block all threads in that process."", ""C"": ""Applications cannot customize their own thread schedulers."", ""D"": ""It requires expensive kernel interaction for basic thread synchronization.""}",1,0
217,10,MCQ,"If a system runs multiple independent processes, each spending \(80\%\) of its time waiting for I/O, what is the minimum number of concurrent processes required to keep CPU idle time (wasted CPU cycles) at or below \(10\%\)?","""C""","{""A"": ""8"", ""B"": ""10"", ""C"": ""11"", ""D"": ""12""}",1.1,0.5
218,10,MCQ,"In a Unix-like system, if a program writes to `stdout` without flushing the buffer (e.g., using `fflush(stdout)`) and then calls `fork()`, what is the expected behavior regarding the buffered output?","""B""","{""A"": ""Only the parent process will print the buffered content because the child's standard output buffer is cleared upon creation."", ""B"": ""The buffered content will be printed twice—once by the parent and once by the child—because the child process inherits a copy of the parent's buffered user-space memory."", ""C"": ""The system call `fork()` automatically flushes all open standard I/O buffers before duplicating the process."", ""D"": ""The program will crash with a segmentation fault when the child process attempts to flush the inherited buffer.""}",1.1,0.5
219,10,MCQ,"Under a pure user-level thread implementation where the operating system kernel is unaware of individual threads, what is the consequence if a single thread executes a blocking system call (such as reading from a file)?","""B""","{""A"": ""The user-level thread scheduler immediately context-switches to another runnable thread within the same process to keep the CPU busy."", ""B"": ""The kernel blocks the entire process, preventing all other user-level threads in that process from executing until the system call completes."", ""C"": ""The kernel dynamically spawns a temporary kernel thread to handle the blocking call while the rest of the process continues."", ""D"": ""The blocking system call fails immediately with an error because user-level threads are restricted to non-blocking operations.""}",1.1,0.5
220,10,MCQ,"Which of the following best describes the operational mechanism and benefit of a hybrid threading model, such as the one implemented for Go's goroutines?","""B""","{""A"": ""It runs user-space threads directly on physical CPU cores without using any kernel-level threads, maximizing execution speed."", ""B"": ""It maps user-level threads onto a pool of kernel-level threads, allowing cheap user-space context switching while ensuring that a blocked thread does not block the entire process."", ""C"": ""It executes all user threads in kernel space to eliminate the overhead of transitioning between user mode and kernel mode."", ""D"": ""It allows user-space applications to dynamically modify the kernel's scheduler code to prioritize specific threads.""}",1.1,0.5
221,10,MCQ,What is a primary architectural trade-off when comparing a microkernel design to a monolithic kernel design?,"""B""","{""A"": ""Microkernels provide better performance due to a smaller memory footprint, but they are significantly harder to port to new hardware architectures."", ""B"": ""Microkernels enhance system reliability and security by running services like device drivers in user space, but they suffer from performance penalties due to frequent inter-process communication (IPC)."", ""C"": ""Monolithic kernels are more robust because their components are isolated in separate address spaces, but they suffer from high system call overhead."", ""D"": ""Monolithic kernels run entirely in user mode to protect the hardware, while microkernels run entirely in privileged kernel mode.""}",1.1,0.5
222,10,MCQ,"In a system where each process spends \(80\%\) of its time waiting for I/O, what is the mathematical relationship used to determine the minimum number of independent processes, \(n\), required to ensure CPU idle (wasted) time is \(10\%\) or less, and what is the resulting minimum integer value of \(n\)?","""A""","{""A"": ""\\(0.8^n \\le 0.1\\), resulting in a minimum of \\(11\\) processes"", ""B"": ""\\(1 - 0.8^n \\le 0.1\\), resulting in a minimum of \\(11\\) processes"", ""C"": ""\\(0.8^n \\le 0.1\\), resulting in a minimum of \\(10\\) processes"", ""D"": ""\\(0.2^n \\le 0.1\\), resulting in a minimum of \\(4\\) processes""}",1.2,1
223,10,MCQ,"Consider a program where a parent process A executes a sequence of fork calls: first, it forks to create process B, which subsequently forks to create process C. If the parent process A then forks a second time to create process D, which of the following statements correctly evaluates the scheduling and creation order of these processes?","""A""","{""A"": ""Process D can be created before process C because CPU scheduling is non-deterministic, allowing process A to be scheduled to execute its second fork before process B executes its fork."", ""B"": ""Process C must always be created before process D because process B is created first in the program's sequential execution path."", ""C"": ""Process D can only be created after process C because a parent process cannot execute a subsequent fork until all existing child processes have completed their initialization."", ""D"": ""Process B and process D are created concurrently by the kernel, meaning process C is guaranteed to be the final process created in all execution scenarios.""}",1.2,1
224,10,MCQ,"Under a User-Level Thread (ULT) implementation, what is the consequence of a single thread triggering a page fault (such as extending the stack or loading a swapped page), and how does this compare to a Kernel-Level Thread (KLT) implementation?","""A""","{""A"": ""In a ULT implementation, the page fault blocks all threads within that process because the kernel only sees the process as a single entity; whereas in a KLT implementation, only the thread triggering the page fault is blocked, allowing other threads to remain runnable."", ""B"": ""In a ULT implementation, the thread table allows the library scheduler to immediately switch to another runnable thread during a page fault; whereas in a KLT implementation, the entire process is blocked by the kernel."", ""C"": ""Both ULT and KLT implementations experience complete process blocking during a page fault because memory management operations must run in kernel mode with interrupts disabled."", ""D"": ""In a ULT implementation, the page fault is handled entirely in user space without blocking any threads; whereas in a KLT implementation, a page fault requires a full context switch that blocks the entire thread pool.""}",1.2,1
225,10,MCQ,"Which of the following sets of instructions must be restricted strictly to execution in Kernel Mode to prevent system corruption or unauthorized interference, and why is reading the time-of-day clock permitted in User Mode?","""A""","{""A"": ""Disabling all interrupts, changing the memory map, and setting the time of day must be restricted to Kernel Mode; reading the time of day is permitted in User Mode because it does not allow a process to corrupt other processes, kernel memory, or critical system-wide synchronization."", ""B"": ""Only changing the memory map must be restricted to Kernel Mode; disabling interrupts and setting the time of day can be safely executed in User Mode because the user-space scheduler can override them."", ""C"": ""Disabling all interrupts and changing the memory map must be restricted to Kernel Mode; setting the time of day is permitted in User Mode because individual processes require independent system clocks to manage local timeouts."", ""D"": ""All four instructions (disabling interrupts, changing the memory map, setting the time of day, and reading the time of day) must be restricted to Kernel Mode to maintain absolute isolation between user processes.""}",1.2,1
226,10,MCQ,"During a system call execution in the Pintos operating system, which of the following correctly describes the transition from User Mode to Kernel Mode, specifically regarding how the CPU identifies the handler and manages the stack frame?","""A""","{""A"": ""The CPU executes the `int 0x30` instruction, jumps to the procedure in the interrupt table defined in `threads/intr-stubs.S` which pushes the frame pointer (\\(ebp\\)), 0, and the interrupt number onto the stack, before calling `intr_entry` to save registers and set up the kernel frame."", ""B"": ""The user process directly calls the `syscall_handler` in `userprog/syscall.c` using a standard C function call, which automatically switches the CPU privilege level and pushes the arguments onto the kernel stack."", ""C"": ""The CPU executes `int 0x30`, which immediately invokes `intr_handler` in `threads/interrupt.c` to save the user registers directly into the process control block without utilizing the stack."", ""D"": ""The `intr_entry` procedure runs in User Mode to validate syscall arguments before executing `int 0x30` to jump directly to `intr_exit` in Kernel Mode.""}",1.2,1
227,9,MCQ,What type of kernel design is used by the Windows NT operating system?,"""C""","{""A"": ""Monolithic kernel"", ""B"": ""Microkernel"", ""C"": ""Hybrid kernel"", ""D"": ""Exo-kernel""}",1,-1
228,9,MCQ,Which operating system has a penguin named Tux as its mascot?,"""B""","{""A"": ""Windows"", ""B"": ""Linux"", ""C"": ""MacOS"", ""D"": ""Solaris""}",1,-1
231,9,MCQ,Which operating system kernel type is structured as a single executable running entirely within its own address space?,"""B""","{""A"": ""Microkernel"", ""B"": ""Monolithic Kernel"", ""C"": ""Hybrid Kernel"", ""D"": ""Exokernel""}",1,-0.5
235,9,MCQ,Which of the following operations is typically permitted in both User Mode and Kernel Mode?,"""B""","{""A"": ""Disabling all hardware interrupts"", ""B"": ""Reading the time of day clock"", ""C"": ""Modifying the system memory map"", ""D"": ""Setting the system time of day""}",1,0
236,9,MCQ,What is a primary disadvantage of using a microkernel architecture compared to a monolithic kernel architecture?,"""C""","{""A"": ""A crash in a file system server will inevitably bring down the entire operating system."", ""B"": ""It results in a larger and more complex kernel that is harder to test and debug."", ""C"": ""It introduces significant performance overhead due to the high volume of inter-process communication (IPC) required between separate servers."", ""D"": ""It prevents the operating system from being ported to different hardware architectures.""}",1,0
240,9,MCQ,Which of the following correctly describes the structural and operational differences between microkernels and hybrid kernels?,"""A""","{""A"": ""Microkernels run services like file systems and device drivers as separate processes in user-mode to prevent system-wide crashes, whereas hybrid kernels structure these services similarly but run most of them in kernel space to reduce IPC overhead, meaning a failure can bring down the entire system."", ""B"": ""Microkernels eliminate interprocess communication (IPC) overhead by executing all servers within a single unified address space, while hybrid kernels rely on isolated user-mode processes to prevent failures from affecting the core kernel."", ""C"": ""Hybrid kernels achieve high performance by running all components exclusively in user-mode, whereas microkernels run all services in kernel-mode to ensure complete hardware access."", ""D"": ""Microkernels are designed to run only on multiprocessor systems to handle high IPC overhead, whereas hybrid kernels are restricted to single-core embedded systems to avoid synchronization issues.""}",1.1,0.5
245,9,MCQ,"In the Pintos operating system, which of the following correctly describes the stack operations and execution flow when a user-mode system call is initiated?","""C""","{""A"": ""The user-mode process manually pushes the frame pointer (\\(ebp\\) register), 0, and the interrupt number onto the stack before executing the `int 0x30` instruction."", ""B"": ""When the CPU executes the `int 0x30` instruction, it directly invokes the `syscall_handler` in `userprog/syscall.c`, which then pushes the frame pointer (\\(ebp\\) register) and registers to the stack."", ""C"": ""When the CPU executes the `int 0x30` instruction, it jumps to the procedure pointed to by the entry in the interrupt table, which puts the frame pointer (\\(ebp\\) register), 0, and the interrupt number on the stack, followed by `intr_entry` saving registers and setting up the kernel frame."", ""D"": ""The `intr_exit` procedure is called immediately after `int 0x30` to save registers and set up the kernel frame, after which it falls through to `intr_entry` to execute the system call.""}",1.2,1
250,10,MCQ,"Which of the following is defined as a single executable with its own address space, where all parts of the kernel execute in that same address space?","""B""","{""A"": ""Microkernel"", ""B"": ""Monolithic Kernel"", ""C"": ""Hybrid Kernel"", ""D"": ""Exokernel""}",1,-1
251,10,MCQ,What is the name of the Linux process control block?,"""C""","{""A"": ""pcb_struct"", ""B"": ""process_control_block"", ""C"": ""task_struct"", ""D"": ""thread_control_block""}",1,-1
252,10,MCQ,Which system call is used in Unix-like systems to create a copy of the parent/calling process?,"""D""","{""A"": ""execve"", ""B"": ""waitpid"", ""C"": ""kill"", ""D"": ""fork""}",1,-1
253,10,MCQ,What is the mascot of the Linux operating system?,"""B""","{""A"": ""A gopher named Go"", ""B"": ""A penguin named Tux"", ""C"": ""A devil named Beastie"", ""D"": ""A gnu named Richard""}",1,-1
254,10,MCQ,Which of the following describes a monolithic kernel?,"""B""","{""A"": ""A minimal kernel providing only basic functionality, with separate servers running in user-mode."", ""B"": ""A kernel structured as a single executable where all parts of the kernel execute in one address space."", ""C"": ""A kernel that runs entirely in user space to prevent system crashes."", ""D"": ""A combination of a microkernel and a monolithic kernel where some components run in kernel space to remove IPC overhead.""}",1,-0.5
255,10,MCQ,What is the primary purpose of the Hardware Abstraction Layer (HAL) in Windows NT?,"""C""","{""A"": ""To run user-mode applications in a secure sandbox."", ""B"": ""To manage the file system and directory structures directly."", ""C"": ""To separate out hardware-specific details, making it easier to port the operating system to a new architecture."", ""D"": ""To provide a command-line interface for system administrators.""}",1,-0.5
256,10,MCQ,Which of the following is a key characteristic of User Level Threads?,"""C""","{""A"": ""The kernel is fully aware of the threads and schedules them individually."", ""B"": ""Thread creation, termination, and switching are slow due to constant kernel involvement."", ""C"": ""A blocking system call on any single thread blocks all threads in that process."", ""D"": ""They require hardware support to perform context switching.""}",1,-0.5
