id,topic_id,type,text,answer,options,irt_a,irt_b
326,9,MULTI_MCQ,Which of the following are advantages of splitting an operating system into user mode and kernel mode?,"[""B"", ""C""]","{""A"": ""Improved protection, as code running in kernel mode is restricted from causing damage to user-mode processes."", ""B"": ""Enhanced reliability, since a process running in user-mode can crash and be restarted without bringing down the entire system."", ""C"": ""Increased security, because isolating applications in user space restricts the damage a malicious program can do."", ""D"": ""Significantly reduced performance overhead, because transitions between user and kernel mode are extremely cheap.""}",1,-0.5
327,9,MULTI_MCQ,Which of the following characteristics are typical of a monolithic kernel design?,"[""A"", ""B"", ""D""]","{""A"": ""The entire kernel executes as a single executable within its own address space."", ""B"": ""All components (such as the file system, scheduler, and device drivers) run in the same address space."", ""C"": ""It is highly robust because if any part of the kernel fails, only that specific component crashes while the rest of the system remains unaffected."", ""D"": ""Communication between kernel components is fast because it can be done via simple function calls or direct memory reads/writes.""}",1,-0.5
331,9,MULTI_MCQ,Which of the following operations should be restricted to executing strictly in kernel mode to ensure system protection and stability?,"[""A"", ""C"", ""D""]","{""A"": ""Disabling hardware interrupts"", ""B"": ""Reading the time of day clock"", ""C"": ""Modifying the system memory map"", ""D"": ""Setting the system time of day""}",1,0
332,9,MULTI_MCQ,"When comparing monolithic kernels and microkernels, which of the following statements accurately describe their respective trade-offs?","[""A"", ""B"", ""D""]","{""A"": ""Monolithic kernels typically offer faster communication between components because all parts execute in a single address space."", ""B"": ""Microkernels provide better robustness because individual servers can crash and be restarted without taking down the entire operating system."", ""C"": ""Monolithic kernels are easier to test and formally verify because all components are tightly integrated."", ""D"": ""Microkernels suffer from increased performance overhead due to the high volume of inter-process communication (IPC) required between isolated servers.""}",1,0
335,9,MULTI_MCQ,Which of the following statements accurately describe the trade-offs and characteristics of monolithic kernels and microkernels?,"[""A"", ""B"", ""D""]","{""A"": ""In a monolithic kernel, all parts of the kernel execute in a single address space, which makes communication between components fast but reduces robustness because a failure in one component can crash the entire system."", ""B"": ""Microkernels improve robustness by running services like file systems and device drivers as user-mode processes, meaning these servers can fail or crash without bringing down the entire system."", ""C"": ""Hybrid kernels completely eliminate inter-process communication (IPC) overhead by running all user-level servers with the same performance as monolithic kernels."", ""D"": ""Monolithic kernels are generally more complex and harder to prove correct than microkernels because of the lack of separation between their components.""}",1.1,0.5
336,9,MULTI_MCQ,"When analyzing the division of an operating system into User Mode and Kernel Mode, which of the following statements are correct?","[""A"", ""C""]","{""A"": ""Disabling all interrupts and changing the memory map are privileged operations that should only be allowed in kernel mode to prevent user processes from corrupting the system."", ""B"": ""Reading the time of day clock is a strictly privileged instruction that can only be executed when the CPU is running in kernel mode."", ""C"": ""Running processes in user mode provides protection and security because user-mode processes are isolated and cannot directly access privileged CPU instructions or hardware."", ""D"": ""Transitioning between user mode and kernel mode is a zero-overhead operation because modern processors handle mode switches entirely in hardware.""}",1.1,0.5
340,9,MULTI_MCQ,"Which of the following statements correctly evaluate the architectural trade-offs and characteristics of monolithic, microkernel, and hybrid kernel designs?","[""A"", ""B""]","{""A"": ""Monolithic kernels achieve high performance because all components execute within a single address space, allowing fast communication via direct function calls and memory access."", ""B"": ""Microkernels improve system robustness by running services like file systems and device drivers as isolated user-mode processes, though this introduces significant inter-process communication (IPC) overhead."", ""C"": ""Hybrid kernels completely avoid running any server components in kernel space, instead executing all servers in user space to achieve absolute isolation."", ""D"": ""Monolithic kernels are easier to formally verify and test in isolation compared to microkernels because of their unified structure.""}",1.2,1
341,9,MULTI_MCQ,Which of the following actions or instructions must be restricted exclusively to execution in kernel mode to maintain system security and stability?,"[""A"", ""C"", ""D""]","{""A"": ""Disabling all CPU interrupts to prevent preemption during critical operations."", ""B"": ""Reading the system's time-of-day clock to obtain a timestamp."", ""C"": ""Changing the system's memory map to alter address translation."", ""D"": ""Setting the system's time-of-day clock to synchronize the system time.""}",1.2,1
110,9,OPEN,"What are the two primary modes of operation in an operating system, and how do they differ in terms of hardware access?","""The two primary modes of operation are kernel mode and user mode. Kernel mode operates with elevated privileges, granting full access to all hardware, memory, and CPU instructions. In contrast, user mode is unprivileged, meaning processes cannot directly access hardware or execute privileged instructions and must instead use system calls to request services from the kernel.""",null,1,-1
115,9,OPEN,Explain why it is infeasible to build an operating system that is completely portable to different system architectures without any modification.,"""By definition, an operating system must interact directly with the underlying hardware. Because of this, it necessarily contains low-level code that depends on the specific characteristics of the processor architecture, such as its instruction set and memory management system. Therefore, an operating system cannot be run on a completely different architecture without at least some platform-specific modifications.""",null,1,-0.5
120,9,OPEN,"What are the primary trade-offs in terms of protection, reliability, and performance when designing an operating system that splits execution into user mode and kernel mode?","""Splitting execution into user and kernel modes enhances protection and reliability by isolating user-space processes so that crashes or malicious actions cannot easily corrupt kernel memory or bring down the entire system. However, this design introduces a performance penalty because transitions across the user-kernel boundary (such as handling interrupts or system calls) are expensive. Additionally, it restricts programmers to using the abstraction interfaces provided by the OS rather than allowing direct hardware access.""",null,1,0
124,9,OPEN,Explain how the architectural differences between monolithic kernels and microkernels lead to their respective trade-offs in performance and robustness.,"""Monolithic kernels execute all components, such as file systems and device drivers, within a single address space, which maximizes performance by enabling fast direct communication but reduces robustness because a failure in any single component can crash the entire system. In contrast, microkernels run these services as separate processes in user-mode, which enhances robustness by isolating failures so a crashed server can be restarted without bringing down the system, but this design introduces significant performance overhead due to the extensive inter-process communication required.""",null,1.1,0.5
125,9,OPEN,"Why is it impossible to build an operating system that is highly portable without any code modification, and how do operating systems resolve this design challenge to achieve portability?","""Complete portability without modification is impossible because an operating system must interact directly with hardware, meaning it inevitably contains code dependent on specific processor architectures, instruction sets, and memory management systems. To resolve this, portable operating systems are split into a platform-specific part that handles low-level hardware interactions and must be rewritten for new platforms, and a platform-independent part that implements general OS functionality and can simply be recompiled for the new architecture.""",null,1.1,0.5
129,9,OPEN,Evaluate the architectural consequences of a critical device driver failure in a monolithic kernel versus a microkernel design. Justify which architecture provides superior robustness in this scenario and explain the associated performance trade-off.,"""In a monolithic kernel, all components, including device drivers, execute within a single address space in kernel mode. Consequently, a driver failure can corrupt kernel memory and crash the entire system. In contrast, a microkernel runs device drivers as separate servers in user mode, allowing a crashed driver to be isolated and restarted without bringing down the system, which provides superior robustness. However, this robustness comes at the cost of performance, as the microkernel requires significant inter-process communication (IPC) overhead to facilitate interaction between these isolated servers.""",null,1.2,1
130,9,OPEN,Explain why it is fundamentally infeasible to design an operating system that is highly portable across different processor architectures without any code modification. Describe how a highly portable operating system architecture can be structured to minimize the effort required to port it to a new platform.,"""An operating system must interact directly with hardware, meaning it inherently contains code that depends on processor-specific details like instruction sets and memory management systems, making zero-modification portability impossible. To minimize porting effort, a highly portable OS divides its design into a platform-specific part and a platform-independent part. The platform-specific part contains all architecture-dependent code and exposes an API, while the platform-independent part implements general OS functionality using this API. When porting to a new architecture, only the platform-specific layer needs to be rewritten, while the rest of the OS can simply be recompiled.""",null,1.2,1
162,9,OPEN,What are the primary advantages of splitting an operating system into user mode and kernel mode?,"""Splitting an operating system into user mode and kernel mode provides three primary advantages: protection, reliability, and security. Protection prevents user-level applications from executing privileged instructions that could corrupt memory or crash the system. Reliability ensures that if a user-mode process crashes, it can be restarted without bringing down the entire operating system. Security isolates applications in their own user spaces, restricting the potential damage a malicious program can cause.""",null,1,-1
165,9,OPEN,Why is it infeasible to build an operating system that is portable to different system architectures without any modification?,"""An operating system must interact directly with the underlying hardware by definition. Because of this, it inevitably contains code that depends on the specific details of the processor architecture, such as its instruction set and memory management system, making complete portability without modification impossible.""",null,1,-0.5
170,9,OPEN,"How do the resource management priorities of a smartphone operating system differ from those of a supercomputer operating system, and why?","""A supercomputer operating system primarily prioritizes maximizing computational performance, focusing heavily on the efficient allocation of processors and memory to handle intensive workloads. In contrast, a smartphone operating system must prioritize energy conservation due to limited battery life. Consequently, a smartphone OS will actively manage power by putting the CPU to sleep or disabling unused hardware features, which is not a primary concern for a supercomputer.""",null,1,0
173,9,OPEN,"Compare monolithic kernels and microkernels in terms of their robustness and performance, explaining how their architectural differences lead to these trade-offs.","""Monolithic kernels offer high performance because all components, such as the file system and device drivers, execute within a single address space, allowing fast communication via direct function calls. However, this lack of isolation reduces robustness, as a failure in any single kernel component can crash the entire system. In contrast, microkernels improve robustness by running services as isolated user-mode processes that can crash and restart without bringing down the system, but this architecture introduces significant performance overhead due to the heavy inter-process communication (IPC) required between these separate servers.""",null,1.1,0.5
174,9,OPEN,"Why is it fundamentally impossible to build an operating system that is completely portable to any hardware architecture without any code modification, and how do highly portable operating systems address this limitation in their design?","""An operating system must interact directly with physical hardware, meaning it inevitably contains code that depends on architecture-specific details such as the processor's instruction set and memory management system. To achieve high portability, operating systems are designed with a strict separation between a platform-specific part and a platform-independent part. When porting the OS, only the platform-specific part (which handles low-level hardware interactions) needs to be rewritten, while the platform-independent part can simply be recompiled for the new architecture.""",null,1.1,0.5
178,9,OPEN,"Compare monolithic and microkernel architectures in terms of their robustness and performance, and explain how a hybrid kernel design attempts to compromise between these two paradigms.","""Monolithic kernels execute all components in a single address space, offering high performance through fast communication but lower robustness because a failure in any component can crash the entire system. In contrast, microkernels run services as separate user-mode processes, which isolates failures to improve robustness but introduces significant performance overhead due to intensive inter-process communication (IPC). A hybrid kernel compromises by structuring some components as servers but running them inside kernel space, aiming to maintain the modularity of a microkernel while reducing IPC overhead to improve performance.""",null,1.2,1
230,9,OPEN,"What is the mascot of the Linux operating system, and what is the story behind its selection?","""The mascot of the Linux operating system is a penguin named Tux. It was chosen after Linus Torvalds was bitten by a penguin at the National Zoo & Aquarium in Canberra, Australia, in 1996.""",null,1,-1
234,9,OPEN,Why is it infeasible to build an operating system that is completely portable to different system architectures without any modification?,"""By definition, an operating system must interact directly with the underlying hardware. Because of this, it inherently contains code that depends on the specific details of the processor architecture, such as its instruction set and memory management system, making it impossible to run on different architectures without modification.""",null,1,-0.5
239,9,OPEN,"Explain how a microkernel architecture improves system robustness compared to a monolithic kernel architecture, and identify the primary performance trade-off associated with this design choice.","""A microkernel improves robustness by running non-essential services, such as file systems and device drivers, as separate processes in user space. If one of these user-space servers crashes, it can be restarted independently without bringing down the entire operating system, whereas a crash in any part of a monolithic kernel can cause the entire system to fail. However, this design introduces a performance trade-off due to high inter-process communication (IPC) overhead, as components must frequently communicate across separate address spaces.""",null,1,0
243,9,OPEN,"Explain how the architectural differences between monolithic kernels and microkernels impact both system robustness and performance when a non-essential system service, such as a device driver, crashes.","""In a monolithic kernel, all components run in a single address space in kernel mode, meaning a crash in a device driver can corrupt kernel memory and bring down the entire system, though normal communication remains highly efficient. In contrast, a microkernel runs services as isolated processes in user space, allowing a crashed driver to be restarted without crashing the system, which greatly improves robustness. However, this isolation introduces a performance penalty because communicating with the user-space service requires expensive inter-process communication (IPC) overhead.""",null,1.1,0.5
244,9,OPEN,"Why is it fundamentally impossible to design a highly portable operating system that requires absolutely no code modification when moving to a new hardware architecture, and how do modern operating systems structurally resolve this limitation?","""An operating system must directly interact with physical hardware, meaning it inherently contains code that depends on architecture-specific details like instruction sets and memory management systems, making zero-modification portability impossible. To resolve this, modern operating systems split their architecture into a platform-specific layer (like the Hardware Abstraction Layer) and a platform-independent layer. When porting the OS, only the platform-specific layer needs to be rewritten or modified, while the platform-independent layer can simply be recompiled.""",null,1.1,0.5
248,9,OPEN,"Evaluate the trade-offs between monolithic kernels and microkernels regarding robustness and performance. How does a hybrid kernel design attempt to balance these trade-offs, and what is the primary structural risk associated with this compromise?","""Monolithic kernels offer high performance because all components share an address space, but they lack robustness since a failure in any component can crash the entire system. Microkernels improve robustness by running services as isolated user-mode processes, but this introduces significant performance overhead due to heavy inter-process communication (IPC). A hybrid kernel attempts to balance this by structuring components as servers but running them within kernel space to eliminate IPC overhead; however, this compromise means that a failure in these kernel-space components can still destabilize and crash the entire system.""",null,1.2,1
249,9,OPEN,Explain why it is fundamentally infeasible to design an operating system that can be ported to a completely different hardware architecture without any code modification. How do operating systems structurally resolve this challenge to make porting as efficient as possible?,"""An operating system must interact directly with physical hardware, meaning it inevitably contains code that is strictly dependent on a specific processor's instruction set and memory management system. To make porting feasible, OS designers split the system into a platform-specific layer (such as the Hardware Abstraction Layer in Windows NT) and a platform-independent layer. When porting to a new architecture, only the low-level, platform-specific layer needs to be rewritten or modified, while the rest of the OS functionality can simply be recompiled using the APIs exposed by that layer.""",null,1.2,1
275,9,OPEN,What are the primary advantages of splitting an operating system's execution into user mode and kernel mode?,"""Splitting an operating system into user mode and kernel mode provides key benefits in protection, reliability, and security. Running user applications in an unprivileged user mode ensures they cannot access privileged CPU instructions or directly corrupt critical system memory. This isolation means that if a user-mode process crashes, it can be safely restarted without bringing down the entire operating system, thereby enhancing overall system reliability and security.""",null,1,-1
280,9,OPEN,Why is it considered infeasible to build an operating system that is highly portable without requiring any modifications when moving to a different system architecture?,"""An operating system must interact directly with the underlying hardware by definition. Because of this, it inevitably contains code that is strictly dependent on the specific details of the processor architecture, such as its instruction set and memory management system, making complete portability without modification impossible.""",null,1,-0.5
285,9,OPEN,"Contrast monolithic kernels and microkernels in terms of their robustness and performance, explaining the architectural reasons for these differences.","""Monolithic kernels offer high performance because all components (such as the scheduler, file system, and device drivers) execute within a single address space, allowing fast communication via direct function calls. However, this lack of isolation reduces robustness, as a failure in any single kernel component can crash the entire system. In contrast, microkernels improve robustness by running services as isolated user-mode processes, meaning a crash in one service does not bring down the entire system. However, this architecture incurs a significant performance penalty due to the high overhead of inter-process communication (IPC) required to coordinate these separate services.""",null,1,0
289,9,OPEN,"Compare monolithic kernels and microkernels in terms of their robustness and performance trade-offs, and explain how a hybrid kernel design attempts to compromise between these two architectures.","""Monolithic kernels run all components in a single address space, which provides high performance due to fast communication but suffers from low robustness because a failure in any component can crash the entire system. In contrast, microkernels improve robustness by running services as isolated user-mode processes that can fail and restart without crashing the system, though this introduces high inter-process communication (IPC) overhead. Hybrid kernels attempt to compromise by structuring some components as servers but running them within kernel space, reducing IPC overhead while maintaining some architectural separation.""",null,1.1,0.5
290,9,OPEN,"Explain how splitting an operating system's execution into user mode and kernel mode enhances system protection and reliability, and analyze the primary performance cost associated with this architectural decision.","""Splitting execution into user mode and kernel mode enhances protection because unprivileged user-mode processes cannot directly access hardware or execute privileged instructions, preventing them from corrupting other processes or the kernel. Reliability is improved because if a user-mode process crashes, it can be safely restarted by the kernel without bringing down the entire system. However, this separation introduces a significant performance cost due to the expensive overhead associated with transitioning through the kernel-user mode boundary during system calls or interrupts.""",null,1.1,0.5
293,9,OPEN,"How does the architectural design of a hybrid kernel, such as Windows NT, attempt to balance the trade-offs between a monolithic kernel and a pure microkernel, and what is the critical vulnerability introduced by this compromise?","""A hybrid kernel balances trade-offs by structuring its services similarly to a microkernel, but running most of these components within kernel space rather than user space to eliminate high inter-process communication (IPC) overhead. While this design compromise improves performance compared to pure microkernels, it compromises robustness. Because these components run in kernel memory with elevated privileges, a failure in any single service can corrupt kernel memory and bring down the entire system, resulting in a total system crash.""",null,1.2,1
294,9,OPEN,"Explain why it is fundamentally infeasible to build a highly portable operating system without any platform-specific modifications, and describe how modern operating systems are structured to overcome this limitation.","""An operating system must interact directly with physical hardware, meaning it inherently contains code that depends on processor-specific instruction sets and memory management systems, making absolute zero-modification portability impossible. To overcome this, highly portable operating systems are divided into a platform-specific part and a platform-independent part. The platform-specific part directly handles low-level hardware interactions and exposes an API, allowing the platform-independent functionality to be written generally and simply recompiled when porting to a new architecture.""",null,1.2,1
